<?xml version="1.0" encoding="utf-8" ?>
<!--
  Project:      Filmakademie Application Framework
  File:         depthoffield.xml
  Description:  Contains the XML description of Blur nodes.
  Author:       Nils Zweiling <nils.zweiling@filmakademie.de>
  Copyright:    (c) 2009 Filmakademie Baden-WÃ¼rttemberg
  Hint:         You can use Visual Studio to edit the file. It helps following the rules of the document type
                definition from the nodetype.dtd file.
-->

<!DOCTYPE nodetype SYSTEM "../../../nodetype.dtd">
<nodetype name="GaussBlur" category="Shading" color="7, 45, 87" plugin="ShadingTemplate.dll">
  <parameters>
    <parameter name="Shader Name" type="String" defaultValue="GaussBlurShader"/>
    <parameter name="Resource Location" type="String" defaultValue="resources/GaussBlur_Shader"/>
    <parameter name="Reload" type="Command"/>
    <parameters name="Input Maps">
      <parameter name="Input Map Scene" type="Image" pin="in" selfEvaluating="false"/>
    </parameters>
    <parameters name="Shader Parameters Pass 0">
      <parameter name="BlurWidth" type="Float" inputMethod="SliderPlusSpinBox" defaultValue="1.0" minValue="0.0" maxValue="3.0" stepSize="0.01"/>
    </parameters>
  </parameters>
</nodetype>


