<?xml version="1.0" encoding="utf-8" ?>
<!--
  Project:      Filmakademie Application Framework
  File:         bloom.xml
  Description:  Contains the XML description of Bloom nodes.
  Author:       Simon Spielmann <sspielma@filmakademie.de>
  Copyright:    (c) 2011 Filmakademie Baden-WÃ¼rttemberg
  Hint:         You can use Visual Studio to edit the file. It helps following the rules of the document type
                definition from the nodetype.dtd file.
-->

<!DOCTYPE nodetype SYSTEM "../../../nodetype.dtd">
<nodetype name="BrightnessContrast" category="Compositing" color="185, 30, 75" plugin="compositortemplate.dll">
  <parameters>
    <parameter name="Compositor Name" type="String" defaultValue="BrightnessContrastCompositor"/>
    <parameter name="Resource Group Name" type="String" defaultValue="BrightnessContrastShader"/>
    <parameter name="Reload" type="Command"/>
    <parameters name="Input Maps">
      <parameter name="Input Map Scene" type="Image" pin="in" selfEvaluating="false"/>
    </parameters>
    <parameters name="Shader Parameters Pass 0">
      <parameter name="brightness" type="Float" inputMethod="SliderPlusSpinBox" defaultValue="1.0" minValue="0.0" maxValue="10.0" stepSize="0.1"/>
      <parameter name="contrast"   type="Float" inputMethod="SliderPlusSpinBox" defaultValue="1.0" minValue="0.0" maxValue="5.0" stepSize="0.1"/>
    </parameters>
  </parameters>
</nodetype>


