<?xml version="1.0" encoding="utf-8" ?>
<!--
  Project:      Filmakademie Application Framework
  File:         depthoffield.xml
  Description:  Contains the XML description of DepthOfField nodes.
  Author:       Nils Zweiling <nils.zweiling@filmakademie.de>
  Copyright:    (c) 2009 Filmakademie Baden-WÃ¼rttemberg
  Hint:         You can use Visual Studio to edit the file. It helps following the rules of the document type
                definition from the nodetype.dtd file.
-->

<!DOCTYPE nodetype SYSTEM "../../../nodetype.dtd">
<nodetype name="DepthOfField" category="Compositing" color="185, 30, 75" plugin="compositortemplate.dll">
  <parameters>
    <parameter name="Compositor Name" type="String" defaultValue="DepthOfFieldCompositor"/>
    <parameter name="Resource Group Name" type="String" defaultValue="DepthOfFieldShader"/>
    <parameter name="Reload" type="Command"/>
    <parameters name="Input Maps">
      <parameter name="Input Map Scene" type="Image" pin="in" selfEvaluating="false"/>
      <parameter name="Input Map Blur" type="Image" pin="in" selfEvaluating="false"/>
      <parameter name="Input Map Depth" type="Image" pin="in" selfEvaluating="false"/>
    </parameters> 
    <parameters name="Shader Parameters Pass 0">
      <parameter name="focalPlane" type="Float" inputMethod="SliderPlusSpinBox" defaultValue="0.0" minValue="0.0" maxValue="0.1" stepSize="0.001"/>
      <parameter name="radius" type="Float" inputMethod="SliderPlusSpinBox" defaultValue="0.0" minValue="0.0" maxValue="0.1" stepSize="0.001"/>
    </parameters>
  </parameters>
</nodetype>


