<?xml version="1.0" encoding="utf-8" ?>
<!--
  Project:      Filmakademie Application Framework
  File:         bloom.xml
  Description:  Contains the XML description of Bloom nodes.
  Author:       Simon Spielmann <sspielma@filmakademie.de>
  Copyright:    (c) 2011 Filmakademie Baden-WÃ¼rttemberg
  Hint:         You can use Visual Studio to edit the file. It helps following the rules of the document type
                definition from the nodetype.dtd file.
-->

<!DOCTYPE nodetype SYSTEM "../../../nodetype.dtd">
<nodetype name="Bloom" category="Compositing" color="185, 30, 75" plugin="compositortemplate.dll">
  <parameters>
    <parameter name="Compositor Name" type="String" defaultValue="BloomCompositor"/>
    <parameter name="Resource Group Name" type="String" defaultValue="BloomShader"/>
    <parameter name="Reload" type="Command"/>
    <parameters name="Input Maps">
      <parameter name="Input Map Scene" type="Image" pin="in" selfEvaluating="false"/>
    </parameters>
    <parameters name="Shader Parameters Pass 0">
      <parameter name="OriginalImageWeight" type="Float" inputMethod="SliderPlusSpinBox" defaultValue="1.0" minValue="0.0" maxValue="1.0" stepSize="0.001"/>
      <parameter name="BlurWeight" type="Float" inputMethod="SliderPlusSpinBox" defaultValue="0.65" minValue="0.0" maxValue="1.0" stepSize="0.001"/>
      <parameter name="BlurWidthV" type="Float" inputMethod="SliderPlusSpinBox" defaultValue="0.5" minValue="0.0" maxValue="3.0" stepSize="0.01"/>
      <parameter name="BlurWidthH" type="Float" inputMethod="SliderPlusSpinBox" defaultValue="0.5" minValue="0.0" maxValue="3.0" stepSize="0.01"/>
    </parameters>
  </parameters>
</nodetype>


