<?xml version="1.0" encoding="utf-8" ?>
<!--
  Project:      Filmakademie Application Framework
  File:         cld.xml
  Description:  Implementation of the coherent line drawing algorithm: "Coherent Line Drawing" - Kang et al. 2007
  Author:       Marc Spicker <marc.spicker@uni-konstanz.de>
  Copyright:    (c) 2014 Filmakademie Baden-WÃ¼rttemberg
  Hint:         You can use Visual Studio to edit the file. It helps following the rules of the document type
                definition from the nodetype.dtd file.
-->

<!DOCTYPE nodetype SYSTEM "../../../nodetype.dtd">
<nodetype name="LooseAndSketchyGPU" category="Compositing" color="185, 30, 75" plugin="compositortemplate.dll">
  <parameters>
    <parameter name="Compositor Name" type="String" defaultValue="LNSCompositor"/>
    <parameter name="Resource Group Name" type="String" defaultValue="LNSShader"/>
    <parameter name="Reload" type="Command"/>
    <parameters name="Input Maps">
      <parameter name="Input Map Scene" type="Image" pin="in" selfEvaluating="false"/>
    </parameters>
	<parameters name="Shader Parameters Pass 0">
	  <parameter name="sigma" type="Float" inputMethod="SliderPlusSpinBox" minValue="0.1" maxValue="30.0" defaultValue="10.0" stepSize="0.1" description="Sigma of Gaussian blur of input image."/>		
	  <parameter name="sigma2" type="Float" inputMethod="SliderPlusSpinBox" minValue="0.1" maxValue="10.0" defaultValue="1.0" stepSize="0.1" description="Sigma of Gaussian blur of gradient map."/>		
	  <parameter name="edge_thresh" type="Float" inputMethod="SliderPlusSpinBox" minValue="0.0" maxValue="1.0" defaultValue="0.1" stepSize="0.01" description="Edge detection threshold."/>
	  <parameter name="seed_thresh" type="Float" inputMethod="SliderPlusSpinBox" minValue="0.0" maxValue="1.0" defaultValue="0.95" stepSize="0.01" description="Determines the number of stroke seeds."/>
	  <parameter name="line_length" type="Int" inputMethod="SliderPlusSpinBox" minValue="1" maxValue="500" defaultValue="100" stepSize="1"/>
	  <parameter name="mag_thresh" type="Float" inputMethod="SliderPlusSpinBox" minValue="0.0" maxValue="1.0" defaultValue="0.01" stepSize="0.001" description="Seeds in the vector field with a lower magnitude will get discarded."/>
    </parameters>
  </parameters>
</nodetype>
