<?xml version="1.0" encoding="utf-8" ?>
<!--
  Project:      Filmakademie Application Framework
  File:         depth2stereo.xml
  Description:  Contains the XML description of Depth3Stereo node.
  Author:       Simon Spielmann <simon.spielmann@filmakademie.de>
  Copyright:    (c) 2013 Filmakademie Baden-WÃ¼rttemberg
  Hint:         You can use Visual Studio to edit the file. It helps following the rules of the document type
                definition from the nodetype.dtd file.
-->

<!DOCTYPE nodetype SYSTEM "../../../nodetype.dtd">
<nodetype name="Depth2Stereo" category="Compositing" color="185, 30, 75" plugin="compositortemplate.dll">
  <parameters>
    <parameter name="Compositor Name" type="String" defaultValue="Depth2StereoCompositor"/>
    <parameter name="Resource Group Name" type="String" defaultValue="Depth2Stereo"/>
    <parameter name="Reload" type="Command"/>
    <parameters name="Input Maps">
      <parameter name="Input Map RGB" type="Image" pin="in" selfEvaluating="false"/>
      <parameter name="Input Map Z" type="Image" pin="in" selfEvaluating="false"/>
    </parameters> 
    <parameters name="Shader Parameters Pass 0">
      <parameter name="eyeDistance" type="Float" inputMethod="SliderPlusSpinBox" defaultValue="0.0" minValue="-0.1" maxValue="0.1" stepSize="0.001"/>
      <parameter name="hit" type="Float" inputMethod="SliderPlusSpinBox" defaultValue="0.0" minValue="-1" maxValue="1" stepSize="0.01"/>
    </parameters>
  </parameters>
</nodetype>


