<?xml version="1.0" encoding="utf-8" ?>
<!--
  Project:      Filmakademie Application Framework
  File:         filterbilateralsmooth.xml
  Description:  Contains the XML description of FilterBilateralSmooth nodes.
  Author:       Thomas Luft <thomas.luft@web.de>
  Copyright:    (c) 2009 Filmakademie Baden-WÃ¼rttemberg
  Hint:         You can use Visual Studio to edit the file. It helps following the rules of the document type
                definition from the nodetype.dtd file.
-->

<!DOCTYPE nodetype SYSTEM "../../../nodetype.dtd">
<nodetype name="FilterBilateralSmooth" category="Compositing" color="185, 30, 75" plugin="filterbilateralsmooth.dll">
  <parameters>
    <parameter name="Input Map" type="Image" pin="in" selfEvaluating="true"/>
    <parameter name="Resource Group Name" type="String" defaultValue="BilateralSmooth" visible="false"/>
    <parameter name="Reload" type="Command" />
      <parameters name="Polish">
      <parameter name="Smoothness" type="Float" inputMethod="SliderPlusSpinBox" minValue="0.0" maxValue="100.0" defaultValue="50.0" unit=""/>
      <parameter name="Details" type="Float" inputMethod="SliderPlusSpinBox" minValue="0.0" maxValue="100.0" defaultValue="50.0" unit=""/>
    </parameters>
  </parameters>
</nodetype>

