<?xml version="1.0" encoding="utf-8" ?>
<!--
  Project:      Filmakademie Application Framework
  File:         skin.xml
  Description:  Contains the XML description of Skin node.
  Author:       Michael Heberlein <michael.heberlein@filmakademie.de>
  Copyright:    (c) 2011 Filmakademie Baden-WÃ¼rttemberg
  Hint:         You can use Visual Studio to edit the file. It helps following the rules of the document type
                definition from the nodetype.dtd file.
-->

<!DOCTYPE nodetype SYSTEM "../../../nodetype.dtd">
<nodetype name="Skin" category="Compositing" color="185, 30, 75" plugin="compositortemplate.dll">
  <parameters>
    <parameter name="Compositor Name" type="String" defaultValue="SkinCompositor"/>
    <parameter name="Resource Group Name" type="String" defaultValue="SkinShader"/>
    <parameter name="Reload" type="Command"/>
    <parameters name="Input Maps">
      <parameter name="Input Map Scene" type="Image" pin="in" selfEvaluating="false"/>
      <parameter name="Input Map Depth" type="Image" pin="in" selfEvaluating="false"/>
      <parameter name="Input Map IDs" type="Image" pin="in" selfEvaluating="false"/>
    </parameters>
    <parameters name="Shader Parameters Pass 0">
	  <parameter name="sssWidth" type="Float" inputMethod="SliderPlusSpinBox" defaultValue="5.0" minValue="0.0" maxValue="25.0" stepSize="0.1"/>
	  <parameter name="skinId" type="Float" defaultValue="8" inputMethod="SliderPlusSpinBox" minValue="0" maxValue="32" stepSize="0.5"/>
	  <parameter name="correction" type="Float" defaultValue="300" inputMethod="SliderPlusSpinBox" minValue="0" maxValue="1000" stepSize="1"/>
    </parameters>
	
  </parameters>
  
</nodetype>
